{
  "schema_version": "idl_change_request.v1",
  "change_request_id": "CR-FIX-001",
  "previous_episode_id": "EPISODE_ID_HERE",
  "reason": "Corrigir bug: [DESCRICAO_DO_BUG]. Atualmente [COMPORTAMENTO_INCORRETO], deveria [COMPORTAMENTO_CORRETO].",
  "requested_by": {
    "display_name": "Nome do Solicitante",
    "role": "Tech Lead",
    "org": "Nome da Organizacao"
  },
  "scope": {
    "summary": "Corrigir [BUG] em [COMPONENTE]",
    "target": "backend",
    "entities_affected": [
      "EntidadeAfetada"
    ],
    "usecases_affected": [
      "UseCaseAfetado"
    ]
  },
  "acceptance_criteria": [
    "Comportamento corrigido: [descricao do comportamento correto]",
    "Regressao prevenida: [cenario que nao pode quebrar]",
    "Todos os testes existentes devem continuar passando",
    "Novo teste de regressao adicionado para o bug"
  ],
  "invariants": [
    {
      "name": "no_breaking_changes",
      "description": "A correcao nao pode alterar comportamento esperado de outras funcionalidades",
      "severity": "must"
    },
    {
      "name": "data_integrity",
      "description": "Dados existentes devem permanecer validos apos a correcao",
      "severity": "must"
    }
  ],
  "risk": {
    "level": "low",
    "notes": "Correcao pontual com escopo bem definido. Testes de regressao incluidos."
  },
  "attachments": [
    {
      "kind": "note",
      "ref": "Ticket/Issue relacionado: [LINK_OU_ID]"
    }
  ],
  "volatile": {
    "timestamp": "YYYY-MM-DDTHH:MM:SSZ"
  }
}
