{
  "schema_version": "idl_change_request.v1",
  "change_request_id": "CR-FEAT-001",
  "previous_episode_id": "EPISODE_ID_HERE",
  "reason": "Adicionar nova funcionalidade: [NOME_DA_FEATURE]. Esta feature permite [BENEFICIO_PRINCIPAL] para [USUARIO_ALVO].",
  "requested_by": {
    "display_name": "Nome do Solicitante",
    "role": "Product Owner",
    "org": "Nome da Organizacao"
  },
  "scope": {
    "summary": "Adicionar [FEATURE] com [CAPACIDADES_PRINCIPAIS]",
    "target": "backend",
    "entities_affected": [
      "NovaEntidade"
    ],
    "usecases_affected": [
      "NovoUseCase"
    ]
  },
  "acceptance_criteria": [
    "Nova entidade deve ter campos obrigatorios: [lista]",
    "Novo use case deve retornar [resultado esperado]",
    "API deve expor endpoint [verbo] /path",
    "Todos os testes existentes devem continuar passando"
  ],
  "invariants": [
    {
      "name": "api_backward_compatible",
      "description": "Endpoints existentes devem continuar funcionando sem alteracao",
      "severity": "must"
    },
    {
      "name": "no_data_loss",
      "description": "Dados existentes nao podem ser modificados ou removidos",
      "severity": "must"
    },
    {
      "name": "new_fields_nullable",
      "description": "Novos campos devem ser opcionais para manter compatibilidade",
      "severity": "should"
    }
  ],
  "risk": {
    "level": "low",
    "notes": "Mudanca aditiva apenas. Nenhuma modificacao em campos ou logica existentes."
  },
  "attachments": [
    {
      "kind": "note",
      "ref": "Notas adicionais sobre a implementacao ou regras de negocio"
    }
  ],
  "volatile": {
    "timestamp": "YYYY-MM-DDTHH:MM:SSZ"
  }
}
