{
  "schema_version": "idl_change_request.v1",
  "change_request_id": "CR-MIG-001",
  "previous_episode_id": "EPISODE_ID_HERE",
  "reason": "Migracao de schema: [DESCRICAO]. Necessario para [MOTIVO_NEGOCIO].",
  "requested_by": {
    "display_name": "Nome do Solicitante",
    "role": "Tech Lead",
    "org": "Nome da Organizacao"
  },
  "scope": {
    "summary": "Migrar schema de [ENTIDADE] para suportar [NOVA_CAPACIDADE]",
    "target": "backend",
    "entities_affected": [
      "EntidadeComMigracao"
    ],
    "usecases_affected": []
  },
  "acceptance_criteria": [
    "Novo campo [nome] adicionado a entidade [Entidade]",
    "Campo [nome] e opcional (nullable) para dados existentes",
    "Novos registros podem especificar [nome]",
    "API retorna [nome] quando presente",
    "Dados existentes permanecem validos sem o novo campo"
  ],
  "invariants": [
    {
      "name": "existing_data_unaffected",
      "description": "Registros existentes sem o novo campo devem permanecer validos",
      "severity": "must"
    },
    {
      "name": "api_backward_compatible",
      "description": "APIs existentes devem aceitar requests sem o novo campo",
      "severity": "must"
    },
    {
      "name": "no_data_loss",
      "description": "Nenhum dado existente pode ser modificado ou removido",
      "severity": "must"
    }
  ],
  "risk": {
    "level": "medium",
    "notes": "Migracao de schema requer atencao especial. Campo nullable garante compatibilidade. Requer validacao em ambiente de staging antes de producao."
  },
  "attachments": [
    {
      "kind": "note",
      "ref": "Valores default para o novo campo: [ESPECIFICAR_SE_APLICAVEL]"
    },
    {
      "kind": "note",
      "ref": "Plano de rollback: Remover campo se necessario (campo e opcional)"
    }
  ],
  "volatile": {
    "timestamp": "YYYY-MM-DDTHH:MM:SSZ"
  }
}
